question,reference_answer
Как наказывают за публичные призывы к осуществлению экстремистской деятельности?,"Публичные призывы к осуществлению экстремистской деятельности, совершенные с использованием сети Интернет, наказываются по части 2 статьи 280 УК РФ штрафом до трехсот тысяч рублей, либо принудительными работами до трех лет, либо лишением свободы до четырех лет с лишением права занимать определенные должности. Источник: УК РФ, статья 280."
Что грозит за возбуждение ненависти либо вражды по национальному признаку?,"Возбуждение ненависти либо вражды по признакам национальности, совершенное с использованием сети Интернет, наказывается по части 2 статьи 282 УК РФ штрафом от трехсот тысяч до пятисот тысяч рублей, либо принудительными работами до пяти лет, либо лишением свободы до пяти лет. Источник: УК РФ, статья 282."
Какое наказание за организацию деятельности экстремистской организации?,"Организация деятельности экстремистской организации наказывается по статье 282.2 УК РФ штрафом до четырехсот тысяч рублей, либо лишением свободы на срок до шести лет. Источник: УК РФ, статья 282.2."
Что грозит за реабилитацию нацизма?,"Реабилитация нацизма, то есть отрицание фактов, установленных приговором Нюрнбергского трибунала, наказывается по статье 354.1 УК РФ штрафом до трех миллионов рублей, либо принудительными работами до трех лет, либо лишением свободы до трех лет. Источник: УК РФ, статья 354.1."
Как наказывают за незаконное изготовление оружия?,"Незаконное изготовление огнестрельного оружия наказывается по статье 223 УК РФ ограничением свободы до трех лет, либо принудительными работами до четырех лет, либо лишением свободы до четырех лет. Источник: УК РФ, статья 223."
Что грозит за хищение оружия?,"Хищение огнестрельного оружия, совершенное группой лиц по предварительному сговору, наказывается по части 2 статьи 226 УК РФ лишением свободы на срок от пяти до десяти лет. Источник: УК РФ, статья 226."
Какое наказание за незаконный оборот наркотических средств в особо крупном размере?,"Незаконный сбыт наркотических средств в особо крупном размере наказывается по части 4 статьи 228.1 УК РФ лишением свободы на срок от десяти до двадцати лет либо пожизненным лишением свободы. Источник: УК РФ, статья 228.1."
Что грозит за склонение к потреблению наркотиков?,"Склонение к потреблению наркотических средств, совершенное в отношении несовершеннолетнего, наказывается по пункту 'а' части 3 статьи 230 УК РФ лишением свободы на срок от десяти до пятнадцати лет. Источник: УК РФ, статья 230."
Как наказывают за незаконное культивирование наркосодержащих растений?,"Незаконное культивирование наркосодержащих растений в особо крупном размере наказывается по части 2 статьи 231 УК РФ штрафом до трехсот тысяч рублей, либо лишением свободы до двух лет. Источник: УК РФ, статья 231."
Что грозит за организацию притона для потребления наркотиков?,"Организация либо содержание притонов для потребления наркотических средств наказывается по статье 232 УК РФ лишением свободы на срок до четырех лет. Источник: УК РФ, статья 232."
Какое наказание за контрабанду оружия?,"Контрабанда огнестрельного оружия, совершенная организованной группой, наказывается по части 3 статьи 226.1 УК РФ лишением свободы на срок от семи до двенадцати лет со штрафом. Источник: УК РФ, статья 226.1."
Что грозит за незаконный экспорт технологий двойного назначения?,"Незаконный экспорт технологий, которые могут быть использованы при создании вооружения, наказывается по статье 189 УК РФ штрафом до одного миллиона рублей, либо лишением свободы до семи лет. Источник: УК РФ, статья 189."
Как наказывают за уклонение от прохождения военной службы?,"Уклонение от призыва на военную службу при отсутствии законных оснований наказывается по статье 328 УК РФ штрафом до двухсот тысяч рублей, либо принудительными работами до двух лет, либо арестом до шести месяцев, либо лишением свободы до двух лет. Источник: УК РФ, статья 328."
Что грозит за дезертирство?,"Дезертирство, то есть самовольное оставление части в целях уклонения от военной службы, наказывается по статье 338 УК РФ лишением свободы на срок до семи лет. Источник: УК РФ, статья 338."
Какое наказание за нарушение уставных правил взаимоотношений между военнослужащими?,"Нарушение уставных правил взаимоотношений между военнослужащими при отсутствии отношений подчиненности, повлекшее тяжкие последствия, наказывается по части 3 статьи 335 УК РФ лишением свободы на срок до пяти лет. Источник: УК РФ, статья 335."
Что грозит за самовольное оставление части?,"Самовольное оставление части, совершенное впервые, наказывается по части 1 статьи 337 УК РФ ограничением свободы до двух лет, либо арестом до шести месяцев, либо лишением свободы до двух лет. Источник: УК РФ, статья 337."
Как наказывают за злостное неповиновение приказу?,"Злостное неповиновение начальнику, совершенное группой лиц, наказывается по части 2 статьи 332 УК РФ лишением свободы на срок до пяти лет. Источник: УК РФ, статья 332."
Что грозит за превышение должностных полномочий сотрудником полиции?,"Превышение должностных полномочий сотрудником полиции, совершенное с применением насилия, наказывается по пункту 'б' части 3 статьи 286 УК РФ лишением свободы на срок от трех до десяти лет. Источник: УК РФ, статья 286."
Какое наказание за получение взятки в особо крупном размере?,"Получение взятки в особо крупном размере наказывается по части 6 статьи 290 УК РФ штрафом от двух миллионов до пяти миллионов рублей либо лишением свободы на срок от восьми до пятнадцати лет со штрафом. Источник: УК РФ, статья 290."
Что грозит за служебный подлог?,"Служебный подлог, то есть внесение должностным лицом в официальные документы заведомо ложных сведений, наказывается по статье 292 УК РФ штрафом до восьмидесяти тысяч рублей, либо обязательными работами до четырехсот восьмидесяти часов, либо исправительными работами до двух лет, либо арестом до шести месяцев, либо лишением свободы до двух лет. Источник: УК РФ, статья 292."
"Как наказывают за халатность, повлекшую смерть человека?","Халатность, то есть неисполнение должностным лицом своих обязанностей вследствие недобросовестного отношения, повлекшее по неосторожности смерть человека, наказывается по части 3 статьи 293 УК РФ лишением свободы на срок до пяти лет. Источник: УК РФ, статья 293."
